{
  "requirements": {
    "export": ["MER-1", "MER-2", "MER-3", "MER-4", "MER-5", "MER-6"],
    "import": ["MER-7", "MER-8", "MER-9", "MER-10", "MER-11", "MER-12", "MER-13"],
    "invalid": ["MER-7"],
    "round_trip": ["MER-13"]
  },
  "version": 1,
  "note": "export cases write the Mermaid lines and the dropped objects [kind, table, name] of their document, parsed with the documents of their set; import cases read their Mermaid lines into the document named imported and the dropped objects; invalid cases report exactly the listed [rule, line, column] diagnostics; round trip cases export the document at their path with exactly the dropped objects, import the export into a document of the same name with exactly the imported objects, and get back the tables, columns, primary keys and foreign keys of the document. Lines join with LF and end with one. docs/spec/mermaid.md.",
  "export": [
    {
      "document": [
        "dbspec 1 shop",
        "",
        "# accounts",
        "table users {",
        "  id i64 identity",
        "  mail varchar(64)",
        "  age i32 null",
        "  note varchar(32) null default 'say \"hi\"'",
        "  primary key (id)",
        "  unique uq_users_mail (mail)",
        "  check ck_users_age (age >= 0)",
        "  settings {",
        "    immutable",
        "  }",
        "}",
        "",
        "table orders {",
        "  id i64 identity",
        "  user_id i64 null",
        "  total decimal(10,2) default 0.00",
        "  primary key (id)",
        "  index ix_orders_user (user_id)",
        "  foreign key fk_orders_user (user_id) references users (id) on delete set_null on update restrict",
        "}"
      ],
      "documents": {},
      "dropped": [
        [
          "foreign_key",
          "orders",
          "fk_orders_user"
        ],
        [
          "index",
          "orders",
          "ix_orders_user"
        ],
        [
          "check",
          "users",
          "ck_users_age"
        ],
        [
          "comment",
          "users",
          "users"
        ],
        [
          "default",
          "users",
          "note"
        ],
        [
          "settings",
          "users",
          "users"
        ],
        [
          "unique",
          "users",
          "uq_users_mail"
        ]
      ],
      "id": "shop",
      "mermaid": [
        "erDiagram",
        "    orders {",
        "        i64 id PK \"identity\"",
        "        i64 user_id FK \"null\"",
        "        decimal(10-2) total \"default 0.00\"",
        "    }",
        "    users {",
        "        i64 id PK \"identity\"",
        "        varchar(64) mail UK",
        "        i32 age \"null\"",
        "        varchar(32) note \"null\"",
        "    }",
        "    users |o--o{ orders : \"fk_orders_user (user_id) references (id)\""
      ]
    },
    {
      "document": [
        "dbspec 1 notes",
        "",
        "# uses the people document",
        "use people { person }",
        "",
        "# a note",
        "table note {",
        "  # the key",
        "  id i64 identity",
        "  # the author",
        "  author_id i64",
        "  body varchar(64)",
        "  # the primary key",
        "  primary key (id)",
        "  # the unique key",
        "  unique uq_note_body (body)",
        "  # the index",
        "  index ix_note_author (author_id)",
        "  # the foreign key",
        "  foreign key fk_note_author (author_id) references person (id) on delete restrict on update restrict",
        "  # the check",
        "  check ck_note_id (id > 0)",
        "  # the settings",
        "  settings {",
        "    # a setting",
        "    immutable",
        "    # the end of the settings",
        "  }",
        "  # the end of the table",
        "}",
        "",
        "table key_note {",
        "  id i64",
        "  # only the primary key",
        "  primary key (id)",
        "}",
        "",
        "table setting_note {",
        "  id i64",
        "  primary key (id)",
        "  settings {",
        "    # only a setting",
        "    immutable",
        "  }",
        "}",
        "",
        "table closing_note {",
        "  id i64",
        "  primary key (id)",
        "  settings {",
        "    immutable",
        "    # only the end of the settings",
        "  }",
        "}",
        "",
        "# a diagram",
        "diagram main {",
        "  # an entry",
        "  note at 0 0",
        "  # the end of the diagram",
        "}",
        "",
        "# the end of the document"
      ],
      "documents": {
        "people": [
          "dbspec 1 people",
          "",
          "table person {",
          "  id i64 identity",
          "  primary key (id)",
          "}"
        ]
      },
      "dropped": [
        [
          "comment",
          "",
          "main"
        ],
        [
          "comment",
          "",
          "notes"
        ],
        [
          "comment",
          "",
          "people"
        ],
        [
          "diagram",
          "",
          "main"
        ],
        [
          "use",
          "",
          "people"
        ],
        [
          "comment",
          "closing_note",
          "closing_note"
        ],
        [
          "settings",
          "closing_note",
          "closing_note"
        ],
        [
          "comment",
          "key_note",
          "key_note"
        ],
        [
          "check",
          "note",
          "ck_note_id"
        ],
        [
          "comment",
          "note",
          "author_id"
        ],
        [
          "comment",
          "note",
          "ck_note_id"
        ],
        [
          "comment",
          "note",
          "fk_note_author"
        ],
        [
          "comment",
          "note",
          "id"
        ],
        [
          "comment",
          "note",
          "ix_note_author"
        ],
        [
          "comment",
          "note",
          "note"
        ],
        [
          "comment",
          "note",
          "uq_note_body"
        ],
        [
          "index",
          "note",
          "ix_note_author"
        ],
        [
          "settings",
          "note",
          "note"
        ],
        [
          "unique",
          "note",
          "uq_note_body"
        ],
        [
          "comment",
          "setting_note",
          "setting_note"
        ],
        [
          "settings",
          "setting_note",
          "setting_note"
        ]
      ],
      "id": "every-comment",
      "mermaid": [
        "erDiagram",
        "    closing_note {",
        "        i64 id PK",
        "    }",
        "    key_note {",
        "        i64 id PK",
        "    }",
        "    note {",
        "        i64 id PK \"identity\"",
        "        i64 author_id FK",
        "        varchar(64) body UK",
        "    }",
        "    setting_note {",
        "        i64 id PK",
        "    }",
        "    person ||--o{ note : \"fk_note_author (author_id) references (id)\""
      ]
    }
  ],
  "import": [
    {
      "document": [
        "dbspec 1 imported",
        "",
        "table orders {",
        "  id i64 identity",
        "  user_id i64 null",
        "  total decimal(10,2) default 0.00",
        "  primary key (id)",
        "  index ix_orders_user_id (user_id)",
        "  foreign key fk_orders_user (user_id) references users (id) on delete restrict on update restrict",
        "}",
        "",
        "table users {",
        "  id i64 identity",
        "  mail varchar(64)",
        "  age i32 null",
        "  note varchar(32) null",
        "  primary key (id)",
        "}"
      ],
      "dropped": [
        [
          "index",
          "orders",
          "ix_orders_user_id"
        ],
        [
          "unique",
          "users",
          "mail"
        ]
      ],
      "id": "export-shop",
      "mermaid": [
        "erDiagram",
        "    orders {",
        "        i64 id PK \"identity\"",
        "        i64 user_id FK \"null\"",
        "        decimal(10-2) total \"default 0.00\"",
        "    }",
        "    users {",
        "        i64 id PK \"identity\"",
        "        varchar(64) mail UK",
        "        i32 age \"null\"",
        "        varchar(32) note \"null\"",
        "    }",
        "    users |o--o{ orders : \"fk_orders_user (user_id) references (id)\""
      ]
    },
    {
      "document": [
        "dbspec 1 imported",
        "",
        "table customer {",
        "  id i64 identity",
        "  code varchar(32)",
        "  note text",
        "  ref i64",
        "  primary key (id)",
        "}",
        "",
        "table order_line {",
        "  id i64",
        "  customer_id i64",
        "  price decimal(8,2) default 1.50",
        "  primary key (id)",
        "  index ix_order_line_customer_id (customer_id)",
        "  foreign key fk_line_customer (customer_id) references customer (id) on delete restrict on update restrict",
        "}"
      ],
      "dropped": [
        [
          "table",
          "CUSTOMER",
          "CUSTOMER"
        ],
        [
          "comment",
          "customer",
          "note"
        ],
        [
          "foreign_key",
          "customer",
          "ref"
        ],
        [
          "relationship",
          "customer",
          "mirrors"
        ],
        [
          "unique",
          "customer",
          "code"
        ],
        [
          "index",
          "order_line",
          "ix_order_line_customer_id"
        ],
        [
          "relationship",
          "order_line",
          "places"
        ]
      ],
      "id": "foreign-diagram",
      "mermaid": [
        "erDiagram",
        "    %% a diagram from another tool",
        "    CUSTOMER {",
        "        string name",
        "        int id PK",
        "    }",
        "    customer {",
        "        i64 id PK \"identity\"",